{
  "schemaVersion": 1,
  "documentType": "listening-exercise-extension",
  "extensionId": "survival-travel-american-listening-exercises",
  "extensionVersion": "1.2.0",
  "baseCourseId": "survival-travel-american-4w",
  "basePackageVersion": "1.0.0",
  "targetLocale": "en-US",
  "lessons": [
    {
      "lessonId": "w1d1-first-meeting",
      "recommendedDay": 1,
      "listeningUnitId": "st4w-w1d1-listening",
      "baseContentRef": "lesson://survival-travel-american-4w/1.0.0/w1d1/listening",
      "exercises": [
        {
          "exerciseId": "st4w-w1d1-wd-01",
          "type": "word-discrimination",
          "audioSource": {
            "sourceType": "tts-text",
            "segmentId": "seg-st4w-w1d1-wd-01",
            "locale": "en-US",
            "ttsText": "visit"
          },
          "promptZh": "你听到的是哪个词？",
          "options": [
            {
              "optionId": "a",
              "text": "visit"
            },
            {
              "optionId": "b",
              "text": "visa"
            },
            {
              "optionId": "c",
              "text": "village"
            }
          ],
          "correctOptionId": "a",
          "playbackPolicy": {
            "allowSegmentSelection": false,
            "allowRepeat": true,
            "allowedRates": [
              0.75,
              1
            ]
          },
          "rationaleZh": "音频中的词是 visit，表示“访问；旅行”。"
        },
        {
          "exerciseId": "st4w-w1d1-ss-01",
          "type": "short-sentence-choice",
          "audioSource": {
            "sourceType": "transcript-line",
            "segmentId": "seg-st4w-w1d1-ss-01",
            "locale": "en-US",
            "baseContentRef": "lesson://survival-travel-american-4w/1.0.0/w1d1/listening",
            "lineIndex": 3,
            "expectedText": "I'm from Shanghai. I'm visiting Boston this week."
          },
          "promptZh": "哪一项准确概括了说话人的信息？",
          "options": [
            {
              "optionId": "a",
              "text": "来自上海，这周在波士顿旅行"
            },
            {
              "optionId": "b",
              "text": "来自波士顿，这周在上海旅行"
            },
            {
              "optionId": "c",
              "text": "住在上海，下周去波士顿"
            }
          ],
          "correctOptionId": "a",
          "playbackPolicy": {
            "allowSegmentSelection": true,
            "allowRepeat": true,
            "allowedRates": [
              0.75,
              1,
              1.25
            ]
          },
          "rationaleZh": "说话人说自己来自上海，并且这周在波士顿旅行。"
        },
        {
          "exerciseId": "st4w-w1d1-kd-01",
          "type": "keyword-dictation",
          "audioSource": {
            "sourceType": "tts-text",
            "segmentId": "seg-st4w-w1d1-kd-01",
            "locale": "en-US",
            "ttsText": "I'm visiting Boston this week."
          },
          "promptZh": "写出听到的城市名。",
          "answerGuidance": {"answerType": "place-name", "guidanceZh": "填写听到的英文城市名；使用英文单词输入。", "acceptedInputFormats": ["english-words"]},
          "targetKeywords": [
            "Boston"
          ],
          "standardAnswer": "Boston",
          "acceptedAnswers": [
            "Boston"
          ],
          "normalizationHints": {
            "trim": true,
            "caseFoldLocale": "en-US",
            "collapseWhitespace": true,
            "normalizeApostrophes": true,
            "stripTerminalPunctuation": true
          },
          "playbackPolicy": {
            "allowSegmentSelection": true,
            "allowRepeat": true,
            "allowedRates": [
              0.75,
              1
            ]
          },
          "rationaleZh": "地点出现在 visiting 后面：Boston。"
        },
        {
          "exerciseId": "st4w-w1d1-r11-ss-01",
          "type": "short-sentence-choice",
          "audioSource": {
            "sourceType": "transcript-line",
            "segmentId": "seg-st4w-w1d1-r11-ss-01",
            "locale": "en-US",
            "baseContentRef": "lesson://survival-travel-american-4w/1.0.0/w1d1/listening",
            "lineIndex": 0,
            "expectedText": "Hi, I'm Maya."
          },
          "promptZh": "你听到的是哪句话？",
          "options": [
            {
              "optionId": "a",
              "text": "你好，Maya。我是 Leo。很高兴认识你。"
            },
            {
              "optionId": "b",
              "text": "我也很高兴认识你。你来自哪里？"
            },
            {
              "optionId": "c",
              "text": "你好，我是 Maya。"
            }
          ],
          "correctOptionId": "c",
          "playbackPolicy": {
            "allowSegmentSelection": false,
            "allowRepeat": true,
            "allowedRates": [
              0.75,
              1,
              1.25
            ]
          },
          "rationaleZh": "音频中的句子是“你好，我是 Maya。”。"
        },
        {
          "exerciseId": "st4w-w1d1-r11-ss-02",
          "type": "short-sentence-choice",
          "audioSource": {
            "sourceType": "transcript-line",
            "segmentId": "seg-st4w-w1d1-r11-ss-02",
            "locale": "en-US",
            "baseContentRef": "lesson://survival-travel-american-4w/1.0.0/w1d1/listening",
            "lineIndex": 4,
            "expectedText": "Welcome to Boston!"
          },
          "promptZh": "你听到的是哪句话？",
          "options": [
            {
              "optionId": "a",
              "text": "欢迎来到波士顿！"
            },
            {
              "optionId": "b",
              "text": "你好，我是 Maya。"
            },
            {
              "optionId": "c",
              "text": "你好，Maya。我是 Leo。很高兴认识你。"
            }
          ],
          "correctOptionId": "a",
          "playbackPolicy": {
            "allowSegmentSelection": false,
            "allowRepeat": true,
            "allowedRates": [
              0.75,
              1,
              1.25
            ]
          },
          "rationaleZh": "音频中的句子是“欢迎来到波士顿！”。"
        }
      ]
    },
    {
      "lessonId": "w1d2-personal-information",
      "recommendedDay": 2,
      "listeningUnitId": "st4w-w1d2-listening",
      "baseContentRef": "lesson://survival-travel-american-4w/1.0.0/w1d2/listening",
      "exercises": [
        {
          "exerciseId": "st4w-w1d2-wd-01",
          "type": "word-discrimination",
          "audioSource": {
            "sourceType": "tts-text",
            "segmentId": "seg-st4w-w1d2-wd-01",
            "locale": "en-US",
            "ttsText": "last name"
          },
          "promptZh": "你听到的是哪项个人信息？",
          "options": [
            {
              "optionId": "a",
              "text": "first name"
            },
            {
              "optionId": "b",
              "text": "last name"
            },
            {
              "optionId": "c",
              "text": "phone number"
            }
          ],
          "correctOptionId": "b",
          "playbackPolicy": {
            "allowSegmentSelection": false,
            "allowRepeat": true,
            "allowedRates": [
              0.75,
              1
            ]
          },
          "rationaleZh": "音频是 last name，表示“姓”。"
        },
        {
          "exerciseId": "st4w-w1d2-ss-01",
          "type": "short-sentence-choice",
          "audioSource": {
            "sourceType": "transcript-line",
            "segmentId": "seg-st4w-w1d2-ss-01",
            "locale": "en-US",
            "baseContentRef": "lesson://survival-travel-american-4w/1.0.0/w1d2/listening",
            "lineIndex": 2,
            "expectedText": "Could you spell that, please?"
          },
          "promptZh": "工作人员希望客人做什么？",
          "options": [
            {
              "optionId": "a",
              "text": "拼写刚才的信息"
            },
            {
              "optionId": "b",
              "text": "再说一次电话号码"
            },
            {
              "optionId": "c",
              "text": "填写电子邮箱地址"
            }
          ],
          "correctOptionId": "a",
          "playbackPolicy": {
            "allowSegmentSelection": true,
            "allowRepeat": true,
            "allowedRates": [
              0.75,
              1,
              1.25
            ]
          },
          "rationaleZh": "spell that 表示请对方拼写刚才说的内容。"
        },
        {
          "exerciseId": "st4w-w1d2-kd-01",
          "type": "keyword-dictation",
          "audioSource": {
            "sourceType": "tts-text",
            "segmentId": "seg-st4w-w1d2-kd-01",
            "locale": "en-US",
            "ttsText": "My last name is Sun."
          },
          "promptZh": "写出听到的姓。",
          "answerGuidance": {"answerType": "surname", "guidanceZh": "填写听到的英文姓氏；使用英文单词输入。", "acceptedInputFormats": ["english-words"]},
          "targetKeywords": [
            "Sun"
          ],
          "standardAnswer": "Sun",
          "acceptedAnswers": [
            "Sun"
          ],
          "normalizationHints": {
            "trim": true,
            "caseFoldLocale": "en-US",
            "collapseWhitespace": true,
            "normalizeApostrophes": true,
            "stripTerminalPunctuation": true
          },
          "playbackPolicy": {
            "allowSegmentSelection": true,
            "allowRepeat": true,
            "allowedRates": [
              0.75,
              1
            ]
          },
          "rationaleZh": "last name 后面的姓是 Sun。"
        },
        {
          "exerciseId": "st4w-w1d2-r11-ss-01",
          "type": "short-sentence-choice",
          "audioSource": {
            "sourceType": "transcript-line",
            "segmentId": "seg-st4w-w1d2-r11-ss-01",
            "locale": "en-US",
            "baseContentRef": "lesson://survival-travel-american-4w/1.0.0/w1d2/listening",
            "lineIndex": 0,
            "expectedText": "What's your first name?"
          },
          "promptZh": "你听到的是哪句话？",
          "options": [
            {
              "optionId": "a",
              "text": "你的名是什么？"
            },
            {